{
  "schemaVersion": "1.0",
  "frameworkId": "CIS_WINDOWS_11_ENTERPRISE",
  "name": "CIS Microsoft Windows 11 Enterprise Benchmark Mapping Seed",
  "version": "5.0.1",
  "status": "DRAFT",
  "source": {
    "publisher": "Center for Internet Security",
    "release": "5.0.1",
    "publishedAt": null,
    "retrievedAt": "2026-07-22",
    "reference": "https://www.cisecurity.org/benchmark/microsoft_windows_desktop",
    "digestSha256": null
  },
  "scope": [
    "Windows 11 Enterprise",
    "Licensed mapping import required"
  ],
  "license": "No CIS benchmark text is redistributed. This draft contains only CSA metadata and awaits import from a properly licensed source.",
  "createdAt": "2026-07-22",
  "updatedAt": "2026-07-22",
  "maintainer": "CSA",
  "minimumCsaVersion": "3.2",
  "deprecated": false,
  "supersedes": null,
  "supersededBy": null,
  "controls": [],
  "contentHashSha256": "17d99d91f37e82973973d209229fdad7a602752070b10eca92bdb1bd854e5040",
  "assessmentMode": "FORMAL_ASSESSMENT",
  "disclaimers": {
    "en": "This draft contains no licensed CIS benchmark content and is not assessable.",
    "et": "See mustand ei sisalda litsentsitud CIS benchmarki sisu ning seda ei saa hinnata."
  }
}
